";,00;,00;,00
output\result\result-TUW-223906-xstream.xml;"aff0 Vienna University of Technology Interactive Media Sys. Group Austria AT
aff1 University of Vienna Research Group Multimedia Information Systems Austria AT
aff2 Klagenfurt University Institute of Information Technology Austria AT
";"aff2 Vienna University of null Austria, Interactive Media Sys. Group null
aff1 University of Vienna, Austria, Research Group Multimedia null null null
aff0 0Klagenfurt University, Austria, Institute of Information null null null
";,00;,00;,00
output\result\result-TUW-223973-xstream.xml;"aff0 Vienna University of Technology Institute of Software Technology and Interactive Systems Austria AT
";"aff0 0Institute of Software Technology and Interactive Systems Vienna University of Technology Favoritenstrasse 9-11 null Austria AT
";1,00;1,00;1,00
output\result\result-TUW-225252-xstream.xml;"aff0 Vienna University of Technology Institute of Computer Graphics and Algorithms Austria AT
";"aff0 01A Genetic Algorithm with Solution Archive null null null
aff1 Institute of Computer Graphics and Algorithms Vienna University of Technology Favoritenstrae 911/1861 null Austria AT
";,50;1,00;,67
output\result\result-TUW-226000-xstream.xml;"aff0 AIT Austrian Institute of Technology GmbH Health & Environment Department Austria AT
aff1 Vienna University of Technology Institute of Design and Assessment of Technology Austria AT
";"aff0 1AIT Austrian Institute of Technology GmbH, Health & Environment Department null Austria AT
aff1 Vienna University of Technology, Institute of Design and Assessment of Technology null Austria AT
";1,00;1,00;1,00
output\result\result-TUW-226016-xstream.xml;"aff0 Vienna University of Technology Faculty of Informatics null null
";"aff0 to the Faculty of Informatics at the Vienna University of Technology null null null
";1,00;1,00;1,00
output\result\result-TUW-228620-xstream.xml;"aff0 CASED System Security Lab Germany DE
aff1 Martin Luther University Halle Wittenberg null Germany DE
aff2 National Institute of Informatics Information and Society Research Division Japan JP
aff3 Vienna University of Technology Institute for Software Technology Austria AT
";"aff0 0345A. Tjoa Vienna University of Technology, Institute for Software Technology null Austria AT
aff3 N. Sonehara National Institute of Informatics, Information and Society Research Division null Japan JP
aff4 S. Sackmann Martin Luther University Halle Wittenberg null Germany DE
aff5 S. Wohlgemuth ( null null null
";,75;,75;,75
output\result\result-TUW-231707-xstream.xml;"aff0 Vienna University of Technology null Austria AT
aff1 VRVis Research Center null Austria AT
";"aff0 Austria & VRVis Research Center null Austria AT
";1,00;,50;,67
output\result\result-TUW-233317-xstream.xml;"aff0 Vienna University of Technology Institute of Software Technology & Interactive Systems (ISIS) Austria AT
aff1 null XIMES GmbH, Vienna Austria AT
";"aff0 1Institute of Software Technology & Interactive Systems (ISIS), Vienna University of Technology null Austria AT
aff1 XIMES GmbH null Austria AT
";1,00;1,00;1,00
output\result\result-TUW-233657-xstream.xml;"aff0 IEEE null null null
aff1 Vienna University of Technology null null null
aff2 St. Pölten University of Applied Science null null null
";"aff0 0123Alexander Rind is with St. Po ?lten University of Applied Science null null null
aff1 Silvia Miksch is with Vienna University of Technology null null null
aff2 Tim Lammarsch is with Vienna University of Technology null null null
aff3 Wolfgang Aigner is with St. Po ?lten University of Applied Science null null null
";,50;,67;,57
output\result\result-TUW-236063-xstream.xml;"aff0 Vienna University of Technology null Austria AT
aff1 Graz University of Technology null Austria AT
aff1  i-intelligence null null null
aff1 Middlesex University null UK GB
";"aff0 Margit Pohl null null null
";1,00;,25;,40
output\result\result-TUW-236120-xstream.xml;"aff0 HTL Krems Department for Information Technology Austria AT
aff1 Vienna University of Technology Institute for Computer Aided Automation Austria AT
";"aff0 1HTL Krems, Department for Information Technology null Austria AT
aff1 Vienna University of Technology, Institute for Computer Aided Automation null Austria AT
";1,00;1,00;1,00
output\result\result-TUW-237297-xstream.xml;"";"";none extracted value;none expected;NA
output\result\result-TUW-240858-xstream.xml;"aff0 University of Calabria DIMES Italy IT
aff1 University of Oxford Department of Computer Science UK GB
aff2 Vienna University of Technology Institute of Information Systems Austria AT
";"aff0 2DIMES, University of Calabria null Italy IT
aff1 Department of Computer Science, University of Oxford null UK UK
aff2 Institute of Information Systems, Vienna University of Technology null Austria AT
";1,00;1,00;1,00
output\result\result-TUW-245336-xstream.xml;"";"";none extracted value;none expected;NA
output\result\result-TUW-245799-xstream.xml;"aff0 University of Re?i?a null null null
aff0 Vienna University of Technology null Austria AT
";"aff0 0Lect. Dr. Eng. Elisabeta Spunei, “Eftimie Murgu” University of Res?it?a null null null
";1,00;,50;,67
output\result\result-TUW-247301-xstream.xml;"aff0 University of Oxford Department of Computer Science UK GB
aff1 University of Calabria Department of Mathematics and Computer Science Italy IT
aff2 Vienna University of Technology Institute of Information Systems Austria AT
";"aff0 2Department of Computer Science, University of Oxford null UK UK
aff1 Department of Mathematics and Computer Science, University of Calabria null Italy IT
aff2 Institute of Information Systems, Vienna University of Technology null Austria AT
";1,00;1,00;1,00
output\result\result-TUW-247741-xstream.xml;"aff0 Vienna University of Technology null null null
aff1 Univ. of Applied Sciences Western Swizerland null null null
";"aff0 01Univ. of Applied Sciences Western Swizerland null null null
aff1 Vienna University of Technology null null null
";1,00;1,00;1,00
output\result\result-TUW-247743-xstream.xml;"aff0 Technischen Universität Wien Institut für Softwaretechnik null null
";"aff0 01Ao. Univ. Prof. Andreas Rauber null null null
aff1 Quellenstrasse 24B/13/13 A 1100 Wien null null null
";,00;,00;,00
output\result\result-TUW-251544-xstream.xml;"aff0 Österreichische Computer Gesellschaft null null null
aff0 Technische Universität Wien Institut für Softwaretechnik und Interaktive Systeme null null
";"";none extracted value;,00;0
output\result\result-TUW-252847-xstream.xml;"aff0 University Politehnica of Bucharest LAPI Romania RO
aff1 LIST CEA France FR
aff2 University of Vienna & Vienna University of Technology null Austria AT
aff2 Vienna University of Technology null Austria AT
aff4 University of Applied Sciences Western Switzerland null Switzerland CH
";"aff2 LAPI, University Politehnica of null Romania RO
aff0 1CEA null France FR
aff4 Vienna University of null Austria AT
aff3 University of Vienna & Vienna, University of Technology null Austria AT
aff1 HES-SO, University of Applied, Sciences Western null Switzerland CH
";,80;,80;,80
output\result\result-TUW-255712-xstream.xml;"aff0 University College London null United Kingdom GB
";"aff0 0University College London null United Kingdom UK
";1,00;1,00;1,00
output\result\result-TUW-256654-xstream.xml;"aff0 Technische Universität Wien null Austria AT
";"";none extracted value;,00;0
output\result\result-TUW-257397-xstream.xml;"aff0 Vienna University of Technology Institute of Computer Languages null null
";"aff0 0Markus Raab Institute of Computer Languages, Vienna University of Technology null null null
";1,00;1,00;1,00
output\result\result-TUW-257870-xstream.xml;"aff0 Upper Austria University of Applied Sciences Wels Applied Sciences Austria AT
aff1 TU Wien (Vienna University of Technology) null Austria AT
";"aff2 Upper Austria University of, Applied Sciences null Austria AT
aff0 1TU Wien (Vienna University of, Technology) null Austria AT
aff1 Telecare; AAL; User-Centered Design; Older People. null null null
";,67;1,00;,80
